{
    "rows": 8,
    "columns": 12,
    "spacing": 10,
    "settings": {
        "row": 0,
        "col": 4,
        "row_span": 5,
        "col_span": 4
    },
    "task_list": {
        "row": 0,
        "col": 0,
        "row_span": 8,
        "col_span": 4
    },
    "task_desc": {
        "row": 5,
        "col": 4,
        "row_span": 3,
        "col_span": 4
    },
    "live_view": {
        "row": 0,
        "col": 8,
        "row_span": 4,
        "col_span": 4
    },
    "log": {
        "row": 0,
        "col": 8,
        "row_span": 8,
        "col_span": 4
    }
}
